,Creators role- Balanced,Work type
488,"They develop so many tools, but it is easy to get lost as a user, and takes a huge amount of time to navigate all those tools, understand how they work, test them and successfuly apply them to our own image data. Perhaps is good to have video tutorials that also explain for which type of data the tool is most adequate. Even having a summary table with that would be usefull. Although the ZeroCost4Mic for example is a great initiative, written tutorials are hard to navigate through for non computational biologists. Having more videos like for example the ones that Robert Haase or that Craig Daly has on youtube would be very useful.",Balanced
490,"Work together to unify image data management and processing pipelines (enough of having to piece together different tools and moving disconnection datasets around). 
Reward structure 
More funding for maintenance of software tools
More funding for documentation
More funding for serious image analysis remote-access help desks",Balanced
